### ISSUE TITLE
mpTelemetry metric FATS failing from `Exporter Busy: dropping metrics`

### ISSUE THREAD

**Issue by Channyboy** [OpenLiberty/open-liberty#31753]
FAT tests uses remote docker container to deploy OTLP collector.

Server side trying to push/export metrics results in: 
`io.opentelemetry.sdk.metrics.export.PeriodicMetricReader     1 Exporter busy. Dropping metrics.`

Test fails due to missing metrics.

**Comment by Channyboy** [comment]
Observations with tcpdump show that during some metric export events, the exchange between client and server is incomplete.  Normal behviour shows a continued exchange of information from client to server and a payload returned from server to client (roughly a group of 12 requests&responses). However, at times an initial payload is sent from client to the server (i.e., the intervaled exports, an ack is returned but connection stops. This leads to a timeout on the exporter side (i.e., the configured timeout)

Roughly 15 seconds after the failed interaction was initiated, the a retry attempt is made by the exporter. During this time, the exporter continues to export metrics at the export interval, but this is met with an "exporter busy" (the exporter is still trying to complete the initial request/response).

Still uncertain why the connection fails after the initial sequence. As this affects z/os, Perhaps network issue that stems from the connection between Z machines to the fyre machines or an issue with how z/os is handling its TCP connections?

Other observations:
- Sometimes the TCP connection is maintained even after the (multiple) retry attempts (i.e., sequence number contiues)
- Other times the TCP connection is completely reset.

e.g.
Typical successful metric export:
```
15:32:51.648575 IP exporter.host.52410 > collector.host.ddi-tcp-2: Flags [.], ack 60943, win 511, length 0
15:32:52.326121 IP exporter.host.58748 > collector.host.4317: Flags [P.], seq 23881:24123, ack 632, win 2048, length 242
15:32:52.326178 IP collector.host.4317 > exporter.host.58748: Flags [.], ack 24123, win 501, length 0
15:32:52.326269 IP exporter.host.58748 > collector.host.4317: Flags [.], seq 24123:25371, ack 632, win 2048, length 1248
15:32:52.326286 IP collector.host.4317 > exporter.host.58748: Flags [.], ack 25371, win 499, length 0
15:32:52.326271 IP exporter.host.58748 > collector.host.4317: Flags [.], seq 25371:26619, ack 632, win 2048, length 1248
15:32:52.326298 IP collector.host.4317 > exporter.host.58748: Flags [.], ack 26619, win 493, length 0
15:32:52.326274 IP exporter.host.58748 > collector.host.4317: Flags [.], seq 26619:27867, ack 632, win 2048, length 1248
15:32:52.326306 IP collector.host.4317 > exporter.host.58748: Flags [.], ack 27867, win 487, length 0
15:32:52.326276 IP exporter.host.58748 > collector.host.4317: Flags [P.], seq 27867:27987, ack 632, win 2048, length 120
15:32:52.326314 IP collector.host.4317 > exporter.host.58748: Flags [.], ack 27987, win 487, length 0
15:32:52.326939 IP collector.host.4317 > exporter.host.58748: Flags [P.], seq 632:662, ack 27987, win 501, length 30
15:32:52.328440 IP collector.host.4317 > exporter.host.58748: Flags [P.], seq 662:725, ack 27987, win 501, length 63
15:32:52.328707 IP exporter.host.58748 > collector.host.4317: Flags [.], ack 725, win 2047, length 0
15:32:52.363260 IP exporter.host.58748 > collector.host.4317: Flags [P.], seq 27987:28004, ack 725, win 2047, length 17
15:32:52.405244 IP collector.host.4317 > exporter.host.58748: Flags [.], ack 28004, win 501, length 0
```

When it fails, or _stops_, one  request  is sent from the exporter to the collector. The collector acks and then it stops.
